{
  "schemaVersion": "layout-geometry-oracle/v1",
  "capabilityId": "cap.layout-geometry",
  "catalogRole": "regression_oracle",
  "runtimeDecisionUse": "forbidden",
  "sample": {
    "sampleId": "sample.layout-geometry.paper8",
    "sourceDocumentId": "doc.layout-geometry.paper8",
    "fileName": "论文样本8.pdf",
    "mediaType": "application/pdf",
    "sha256": "12e71bd65faecb793f64043c6812d7a3fd372e7f54ceed390e132839fd2504e4",
    "bytes": 476899,
    "pageCount": 11,
    "provenance": {
      "kind": "user_provided",
      "reference": "reviewed-v8 exports; sample.column-pilot.paper8 is the read-only Column dependency"
    }
  },
  "coordinateContract": {
    "coordinateSpace": "pdf-page-top-left-points",
    "unit": "point",
    "origin": "top_left",
    "xDirection": "right",
    "yDirection": "down",
    "rotationApplied": 0,
    "cropBoxBaseline": {
      "x": 0,
      "y": 0,
      "width": 595.276,
      "height": 841.89
    },
    "mediaBoxBaseline": {
      "x": 0,
      "y": 0,
      "width": 595.276,
      "height": 841.89
    }
  },
  "toleranceProfiles": [
    {
      "id": "body-edge",
      "absolutePoints": 3,
      "relativeToPage": 0.005,
      "appliesTo": [
        "x",
        "y",
        "width",
        "height",
        "edge_distance"
      ],
      "rationale": "Human Body boundaries include small approximate safety room; identity and topology stay exact.",
      "cannotOverride": [
        "identity_failure",
        "structural_failure"
      ]
    },
    {
      "id": "object-edge",
      "absolutePoints": 4,
      "relativeToPage": 0.006,
      "appliesTo": [
        "x",
        "y",
        "width",
        "height",
        "edge_distance"
      ],
      "rationale": "Tight independent/protected object edges were visually reviewed; small PDF extraction differences are tolerated.",
      "cannotOverride": [
        "identity_failure",
        "structural_failure"
      ]
    }
  ],
  "pages": [
    {
      "identity": {
        "sourceDocumentId": "doc.layout-geometry.paper8",
        "pageNumber": 1,
        "pageId": "page-1",
        "pageColumnModelRef": "page-column-model/v1:page-1",
        "pageColumnModelHash": "f0a216794e179bdeb5fe1d5c22e3818dd5b5ec8c2cfd453014f2c8b07dfb7891"
      },
      "pageSize": {
        "width": 595.28,
        "height": 841.89
      },
      "rotation": 0,
      "cropBox": {
        "x": 0,
        "y": 0,
        "width": 595.276,
        "height": 841.89
      },
      "mediaBox": {
        "x": 0,
        "y": 0,
        "width": 595.276,
        "height": 841.89
      },
      "regions": [
        {
          "regionId": "p1.main-flow.single.1",
          "regionClass": "body_column",
          "owner": "column:single",
          "expectedGeometry": {
            "x": 35.72,
            "y": 246.33,
            "width": 523.85,
            "height": 462.72
          },
          "toleranceProfileId": "body-edge",
          "relations": [],
          "sourceProvenance": [
            {
              "sourceArtifactId": "paper8:paper8-body-ground-truth-draft.json:p1:p1.main-flow.single.1",
              "producer": "human-corrected-review-export",
              "coordinateSpace": "pdf-page-top-left-points",
              "transformChain": [
                "pdf-point-editor",
                "user-confirmed-corrected-box"
              ]
            }
          ],
          "evidenceRefs": [
            "reviewed-v8/paper8-body-ground-truth-draft.json"
          ],
          "canonicalColumnRef": {
            "pageColumnModelRef": "page-column-model/v1:page-1",
            "authority": "AA-COLUMN-001",
            "columnId": "single"
          }
        },
        {
          "regionId": "p1.independent.title.1",
          "regionClass": "independent_region",
          "owner": "geometry:title",
          "expectedGeometry": {
            "x": 115.77,
            "y": 121.89,
            "width": 363.74,
            "height": 17.22
          },
          "toleranceProfileId": "object-edge",
          "relations": [],
          "sourceProvenance": [
            {
              "sourceArtifactId": "paper8:paper8-non-body-ground-truth-draft.json:p1:p1.independent.title.1",
              "producer": "human-corrected-review-export",
              "coordinateSpace": "pdf-page-top-left-points",
              "transformChain": [
                "pdf-point-editor",
                "user-confirmed-corrected-box"
              ]
            }
          ],
          "evidenceRefs": [
            "reviewed-v8/paper8-non-body-ground-truth-draft.json"
          ],
          "semanticRegionType": "title"
        },
        {
          "regionId": "p1.independent.abstract.2",
          "regionClass": "independent_region",
          "owner": "geometry:abstract",
          "expectedGeometry": {
            "x": 95.77,
            "y": 231.22,
            "width": 403.73,
            "height": 147.13
          },
          "toleranceProfileId": "object-edge",
          "relations": [],
          "sourceProvenance": [
            {
              "sourceArtifactId": "paper8:paper8-non-body-ground-truth-draft.json:p1:p1.independent.abstract.2",
              "producer": "human-corrected-review-export",
              "coordinateSpace": "pdf-page-top-left-points",
              "transformChain": [
                "pdf-point-editor",
                "user-confirmed-corrected-box"
              ]
            }
          ],
          "evidenceRefs": [
            "reviewed-v8/paper8-non-body-ground-truth-draft.json"
          ],
          "semanticRegionType": "abstract"
        },
        {
          "regionId": "p1.independent.section_heading.3",
          "regionClass": "independent_region",
          "owner": "geometry:section_heading",
          "expectedGeometry": {
            "x": 70.87,
            "y": 402.92,
            "width": 110.39,
            "height": 14.35
          },
          "toleranceProfileId": "object-edge",
          "relations": [],
          "sourceProvenance": [
            {
              "sourceArtifactId": "paper8:paper8-non-body-ground-truth-draft.json:p1:p1.independent.section_heading.3",
              "producer": "human-corrected-review-export",
              "coordinateSpace": "pdf-page-top-left-points",
              "transformChain": [
                "pdf-point-editor",
                "user-confirmed-corrected-box"
              ]
            }
          ],
          "evidenceRefs": [
            "reviewed-v8/paper8-non-body-ground-truth-draft.json"
          ],
          "semanticRegionType": "section_heading"
        }
      ]
    },
    {
      "identity": {
        "sourceDocumentId": "doc.layout-geometry.paper8",
        "pageNumber": 2,
        "pageId": "page-2",
        "pageColumnModelRef": "page-column-model/v1:page-2",
        "pageColumnModelHash": "5566997f21d01519a3dfe949f28a6fad98eafd034a865702231fab861ca9e860"
      },
      "pageSize": {
        "width": 595.28,
        "height": 841.89
      },
      "rotation": 0,
      "cropBox": {
        "x": 0,
        "y": 0,
        "width": 595.276,
        "height": 841.89
      },
      "mediaBox": {
        "x": 0,
        "y": 0,
        "width": 595.276,
        "height": 841.89
      },
      "regions": [
        {
          "regionId": "p2.main-flow.single.1",
          "regionClass": "body_column",
          "owner": "column:single",
          "expectedGeometry": {
            "x": 35.72,
            "y": 84.81,
            "width": 523.85,
            "height": 430.86
          },
          "toleranceProfileId": "body-edge",
          "relations": [],
          "sourceProvenance": [
            {
              "sourceArtifactId": "paper8:paper8-body-ground-truth-draft.json:p2:p2.main-flow.single.1",
              "producer": "human-corrected-review-export",
              "coordinateSpace": "pdf-page-top-left-points",
              "transformChain": [
                "pdf-point-editor",
                "user-confirmed-corrected-box"
              ]
            }
          ],
          "evidenceRefs": [
            "reviewed-v8/paper8-body-ground-truth-draft.json"
          ],
          "canonicalColumnRef": {
            "pageColumnModelRef": "page-column-model/v1:page-2",
            "authority": "AA-COLUMN-001",
            "columnId": "single"
          }
        },
        {
          "regionId": "p2.independent.figure_caption.1",
          "regionClass": "independent_region",
          "owner": "geometry:figure_caption",
          "expectedGeometry": {
            "x": 164.61,
            "y": 697.38,
            "width": 266.05,
            "height": 9.96
          },
          "toleranceProfileId": "object-edge",
          "relations": [],
          "sourceProvenance": [
            {
              "sourceArtifactId": "paper8:paper8-non-body-ground-truth-draft.json:p2:p2.independent.figure_caption.1",
              "producer": "human-corrected-review-export",
              "coordinateSpace": "pdf-page-top-left-points",
              "transformChain": [
                "pdf-point-editor",
                "user-confirmed-corrected-box"
              ]
            }
          ],
          "evidenceRefs": [
            "reviewed-v8/paper8-non-body-ground-truth-draft.json"
          ],
          "semanticRegionType": "figure_caption"
        },
        {
          "regionId": "p2.independent.figure.2",
          "regionClass": "independent_region",
          "owner": "geometry:figure",
          "expectedGeometry": {
            "x": 116.22,
            "y": 525.06,
            "width": 362.83,
            "height": 163.95
          },
          "toleranceProfileId": "object-edge",
          "relations": [],
          "sourceProvenance": [
            {
              "sourceArtifactId": "paper8:paper8-non-body-ground-truth-draft.json:p2:p2.independent.figure.2",
              "producer": "human-corrected-review-export",